questions,answers
what character did stan lee create?,"Executioner, Awesome Android, Mac Gargan, Professor X, Sentry, Death-Stalker, Wong, Blob, Shellshock, Plantman"
what disease did anne frank get?,Typhus
who did mario lopez just marry?,Courtney Laine Mazza
what happened to president james garfield?,"Myocardial infarction, Pneumonia, Sepsis"
what time zone am i in missouri?,"Central Time Zone, UTC−06:00"
who is paul mccartney's current wife?,Nancy Shevell
who did warren moon play for?,"Seattle Seahawks, Washington Huskies football, Houston Oilers, Minnesota Vikings, Kansas City Chiefs"
what brand of guitar does steve vai play?,"Ibanez, Ibanez Universe, Ibanez JEM"
what do hungarian people speak?,Hungarian
in what town did ned kelly and his family grow up?,Beveridge
what is bethenny frankel husband name?,Jason Hoppy
what city in australia should i live in quiz?,Australian city
who is the present president of china?,Xi Jinping
who influenced arthur conan doyle?,"Robert Louis Stevenson, Edgar Allan Poe, Joseph Bell, Jules Verne, Walter Scott, Ibn-e-Safi"
when was samuel pepys?,United Kingdom
what are the new york giants home colors?,Blue
who played bob ewell in to kill a mockingbird?,James Anderson
what instrument does fela kuti play?,"guitar, trumpet, Saxophone, Drums, keyboard"
who is kurt busch driving for now?,Miller Lite
who was charlemagne's wife?,"Fastrada, Luitgard, Hildegard of Savoy, Desiderata of the Lombards, Himiltrude"
where did woodrow wilson go to school?,"Johns Hopkins University, Davidson College, Princeton University, University of Virginia School of Law"
who is angelina jolie's husband?,Brad Pitt
what kind of money do they use in aruba?,Aruban florin
what sports do people in france play?,"France national football team, France Davis Cup team, France men's national ice hockey team, France women's national U-18 ice hockey team, France men's national volleyball team, France women's national volleyball team, France national rugby league team, France women's national basketball team, French Luge Team, A1 Team France"
what language do native american indians speak?,"French Language, Spanish Language, English Language, American English"
where did tennessee williams live?,"St. Louis, Columbus, New Orleans, Clarksdale, Mississippi"
what was king louis xiv religion?,Catholicism
what language do they in belgium?,"French Language, German Language, Dutch Language"
where is port st lucie florida on the map?,"Florida, United States of America, St. Lucie County"
what countries are the mediterranean?,"Italy, Spain, France"
what city has the largest population in mexico?,Mexico City
who juan ponce de leon?,Explorer
what state is toronto in?,Ontario
where to watch tv online for free in canada?,Province of Canada
where did the loma prieta earthquake occur?,San Francisco Bay Area
what is the state motto of massachusetts?,Ense petit placidam sub libertate quietem
where did helen keller die?,Easton
who is the current president of chile 2011?,Sebastián Piñera
what would happen if the new madrid fault had an earthquake?,Winter in Madrid
what did jeff corwin major in?,Biologist
where did johann sebastian bach live?,"Arnstadt, Köthen (Anhalt), Leipzig, Weimar, Mühlhausen, Eisenach, Lüneburg, Ohrdruf"
who did bynum get traded to?,"West Windsor-Plainsboro High School North, St. Joseph High School, Solebury School"
what timezone is malaysia?,UTC+8
where was alice walker born?,Eatonton
what do they speak iceland?,Icelandic Language
who taught michelangelo to sculpt?,"Lorenzo de' Medici, Domenico Ghirlandaio, Giovanni Pico della Mirandola, Girolamo Savonarola, Melozzo da Forlì"
what wars have france been involved in?,Hundred Years' War
when did joe mcelderry won x factor?,The X Factor (UK) - Season 6
what is the major language of jamaica?,Jamaican English
who was the members of blackstreet?,"Tony Tyler, Levi Little, Terrell Phillips, Eric Williams, Edward Theodore Riley, Mark Middleton, Glenn Adams, Joseph Stonestreet, Chauncey Black, Dave Hollister"
who did tebow get traded to?,New York Jets
who created the character of sherlock holmes?,Arthur Conan Doyle
what does scottish people speak?,English Language
who all has kim kardashian dated?,"Kanye West, Reggie Bush, Ray J"
what instruments did vivaldi wrote concertos for?,Violin
what book did john steinbeck wrote about the people in the dust bowl?,The Grapes of Wrath
what land did god promise joshua?,Canaan
who is the voice of family guys meg griffin?,Mila Kunis
what countries did queen elizabeth i rule?,England
what channel is the mtv vma awards on?,MTV
what kind of currency does jamaica use?,Jamaican dollar
what type of government does the nigeria have?,"Presidential system, Federal republic, Federation"
what country was william shakespeare born?,United Kingdom
where do they grow rice in italy?,Lombardy
where great britain on the world map?,Europe
what to see in dallas tx?,"Meadows Museum, Texas Theatre, Dallas Convention Center, Dallas Zoo, Dallas Holocaust Museum/Center for Education & Tolerance, George W. Bush Presidential Center, Sixth Floor Museum, The Trammell & Margaret Crow Collection of Asian Art, Dallas World Aquarium, Dallas Arboretum and Botanical Garden"
who did cristina yang's husband cheated on her with?,Preston Burke
who does jemaine clement play in despicable me?,Jerry the Minion
what year did the vietnam war happen?,1960s
who inspired antonio vivaldi?,Johann Sebastian Bach
what type of currency is used in puerto rico?,United States dollar
what is jackie kennedy famous for?,First Lady of the United States
what currency is used in france before euro?,"French franc, Assignat"
what major landforms are located in egypt?,"Sahara, Libyan Desert"
who played nba finals 2010?,Los Angeles Lakers
what does the devil look like in young goodman brown?,The Old Man
what state was ronald reagan governor of?,California
where was my honda motorcycle made?,Tokyo
what did isaac newton discovered as a mathematician?,isaac newton co-developed calculus with gottfried wilhelm leibniz
what is st james palace?,Palace
what airport to fly into to get to clearwater florida?,Clearwater Air Park
what currency do they use in qatar?,Qatari riyal
what are fun things to do in denver colorado?,"Black American West Museum & Heritage Center, Denver Firefighters Museum, Colorado State Capitol, Denver Mint, Molly Brown House, Forney Transportation Museum, Denver Botanic Gardens, Museum of Contemporary Art Denver, Denver Museum of Nature and Science, Chamberlin Observatory"
what did thoreau die from?,Tuberculosis
what do the symbols in the illinois flag represent?,"State Sovereignty, National Union"
what years did the red sox win the world series?,"1918 World Series, 2007 World Series, 2004 World Series, 1903 World Series, 1912 World Series, 1916 World Series, 1915 World Series"
what war was woodrow wilson president for?,World War I
who is carl edwards racing for?,Roush Fenway Racing
where are the florida marlins from?,"Sun Life Stadium, Marlins Park"
what is the main religion in eastern europe?,Zift
what language does romanian people speak?,"Hungarian language, Torlakian, Romanian Language, Romani language, Ukrainian Language"
what date was john adams elected president?,"John Adams Presidential Campaign, 1796"
what contribution did maurice wilkins make to dna?,Albert Lasker Award for Basic Medical Research
what did george w bush do before becoming president?,Governor of Texas
which party was lincoln?,"Illinois Republican Party, Republican Party, National Union Party, Whig Party"
who are the two current illinois senators?,Dick Durbin
what were adolf hitler's parents names?,"Alois Hitler, Klara Hitler"
what did jordyn wieber win gold for?,Gymnastics at the 2012 Summer Olympics – Women's artistic team all-around
what job does bill rancic have?,"Entrepreneur, Businessperson, Writer, Television Producer, Author"
what does michael jackson like to eat?,Vegetarian food
who owns the new england patriots football team?,Robert Kraft
where do the japanese live?,Japan
what is the dollar called in brazil?,Brazilian real
what has lucy hale played in?,"A Cinderella Story: Once Upon A Song, 10 Years, Sorority Wars, The Sisterhood of the Traveling Pants 2, Scream 4, Fear Island, Tinker Bell: Secret of the Wings, Killer in the Family"
who won 2011 heisman trophy?,Robert Griffin III
who is the falcons kicker?,Matt Bryant
where did charles drew go to high school?,Dunbar High School
who won governor race in indiana?,Mitch Daniels
what languages do people speak in egypt?,"Egyptian language, Akkadian language, Hittite language"
what college did florence griffith joyner attend?,"David Starr Jordan High School, University of California, Los Angeles, California State University, Northridge"
what style of art did henri matisse use?,"Fauvism, Impressionism, Neo-impressionism, Modernism"
who was reese witherspoon married too?,"Ryan Phillippe, Jim Toth"
what is the isthmus of panama?,Panama Canal Zone
who is the coach of the la lakers?,Mike D'Antoni
what is illinois state flower called?,Viola
what books did mark twain read?,"George MacDonald, Charles Dickens, Plutarch, Thomas Malory, William Dean Howells, Thomas Paine, Miguel de Cervantes, Robert Browning"
who plays miley cyrus brother?,Guitarist
what language do they speak thailand?,"Mon Language, Lao Language, Khmer language, Hmong language, Thai Language, Cham language, Mlabri language, Malay, Pattani Language, Nyaw Language, Saek language"
what is the san francisco giants mascot?,"Crazy Crab, Lou Seal"
where was tupac born?,East Harlem
where is the main headquarters of the un?,New York City
what utc time zone is arizona?,"Mountain Time Zone, UTC−07:00"
who played elaine's boyfriend on seinfeld?,Jerry Seinfeld
who did juan ponce de leon married?,Leonor de León
what language do they speak in spain wikipedia?,Spanish Language
where to watch live opening ceremony in london?,2012 Summer Olympics
what did fred davis do?,American football player
what country was theodor schwann born in?,Germany
where is the fukushima daiichi located?,"Japan, Okuma"
who plays claudia joy on army wives?,Kim Delaney
where did darfur happen?,Sudan
what language does greece use?,Greek Language
what kind of money does argentina use?,Argentine peso
what hemisphere south america?,"Northern Hemisphere, Southern Hemisphere"
what movies has taylor momsen been in?,"Underdog, Paranoid Park, Spy Kids 2: Island of Lost Dreams, How the Grinch Stole Christmas!, We Were Soldiers, Hansel and Gretel, Spy School, Saving Shiloh, 10 Years"
what show was kim richards in as a child?,Nanny and the Professor
what was henry ford best known for?,Industrialist
what education does jeff corwin have?,"Norwell High School, Bridgewater State College, University of Massachusetts Amherst"
what movies has chris colfer been in?,"8, Russel Fish: The Sausage and Eggs Incident, Glee Encore, Struck by Lightning, Glee: The 3D Concert Movie"
where the queen of denmark lives?,Copenhagen
what did roald dahl write?,"Danny, the Champion of the World, Willy Wonka & the Chocolate Factory, The Witches, The BFG, Charlie and the Chocolate Factory, Fantastic Mr. Fox, 36 Hours, James and the Giant Peach, Matilda"
what county is troy il in?,Madison County
what position does mitt romney hold?,Governor of Massachusetts
who is country singer jewel married to?,Ty Murray
what famous book did adam smith wrote?,The Wealth of Nations
where does the appalachian trail run through?,Eastern United States
where is burundi located on a map?,Africa
what year did mcfly go to the future?,6th March 2006
what clubs has messi played for?,"Argentina national football team, FC Barcelona, FC Barcelona C, FC Barcelona B"
where is merrell shoes headquarters?,Rockford
who does the uk trade with?,"Canada, Angola, Anguilla, United States of America, Sierra Leone"
what color are the baltimore ravens?,"Purple, White, Black, Gold"
who plays karen jackson on shameless?,Rebecca Atkinson
what is tim tebow's religion?,Christianity
what country is singapore next to?,"Eurasia, Southeast Asia, Asia"
what year did detroit pistons win the championship?,"1990 NBA Finals, 2004 NBA Finals, 1989 NBA Finals"
who is ellen bernstein?,Actor
when are the australian open men's finals?,Yearly
when was reagan inaugurated?,1/20/1981
what kind of education did barack obama have?,"Occidental College, Harvard Law School, Noelani Elementary School, Punahou School, State Elementary School Menteng 01, St. Francis of Assisi Catholic School, Columbia University"
what was the last time the pittsburgh pirates had a winning season?,"1979 World Series, 1971 World Series, 1960 World Series, 1909 World Series, 1925 World Series"
what did james k polk believe in?,"Presbyterianism, Methodism"
what currency does south africa have?,South African rand
what religions are recognized in canada?,"Protestantism, Catholicism, Islam"
what airport is closest to cancun?,Cancún International Airport
where is somalia located?,Africa
who played lex luthor in the original superman?,Gene Hackman
where was john f kennedy raised?,"Boston, Massachusetts, Washington, D.C."
what does kat dennings star in?,"The Scream Team, The Answer Man, Raise Your Voice, Charlie Bartlett, Shorts, The 40-Year-Old Virgin, Down in the Valley, Nick and Norah's Infinite Playlist, The House Bunny, Big Momma's House 2"
what did henry kissinger do?,"United States Secretary of State, National Security Advisor"
where does volga river start?,Valdai Hills
who does ryan newman race for?,Alltel
what was the political system in libya?,"Provisional government, Parliamentary republic"
who plays the voice of lois griffin on family guy?,Alex Borstein
what the currency in argentina?,Argentine peso
where does eddie bravo teach?,Brazilian jiu-jitsu
when did michael schumacher win his first title?,1995
where does sally pearson live?,Gold Coast
where is madeira?,"Atlantic Ocean, Azores Canaries Madeira, Madeira Islands archipelago, Portugal"
what country is joseph prince from?,Singapore
when did democritus discovered the atom?,6129 Demokritos
what do they speak in austria?,"Austrian German, Bosnian language, Hungarian language, Croatian language, Serbian language, Bavarian Language, Slovenian language, German Language, Turkish Language"
what things did thomas edison invent?,"Phonograph, Carbon microphone, Mimeograph, Quadruplex telegraph, Electric power distribution, Movie camera, Incandescent light bulb, Phonograph cylinder"
where is the sistine chapel by michelangelo?,Rome
who has played edward quartermaine on general hospital?,David Lewis
what is the zip code for iselin nj?,08830
what are fun things to do in philadelphia?,"Philadelphia Zoo, Wagner Free Institute of Science, African American Museum in Philadelphia, Liberty Bell, Rodin Museum, Independence Hall, Boathouse Row, Academy of Natural Sciences, Reading Terminal Market, Franklin Institute"
who does david carr play for?,"San Francisco 49ers, Carolina Panthers, New York Giants, Houston Texans, Fresno State Bulldogs football"
where did jackie robinson go to school?,"University of California, Los Angeles, Pasadena City College, John Muir High School"
what strings does john mayer?,guitar
who plays stacey in zoey 101?,Lacey Turner
when did sanchez leave usc?,2009 NFL season
who is steven seagal sister?,Brenda Seagal
on what continent is canada found?,North America
what is the primary language of israel?,"Hebrew Language, Arabic Language"
who is married to jane krakowski?,Robert Godley
what role did tom cruise play in endless love?,Billy
what city was ronald reagan born in?,Tampico
what countries in the world speak arabic?,"Tunisia, Eritrea, Saudi Arabia, Comoros"
what 4 states border the pacific ocean?,Oregon
what to do in nadi fiji?,"Garden of the Sleeping Giant, Subar Maniya, Yasawa, Kula Eco Park, Mamanuca Islands, Nananu-i-Ra, Koroyanitu National Park, Navala Bures, Denerau Beach, Sri Siva Subramaniya temple"
when does medicare part d start?,Centers for Medicare and Medicaid Services
what is the postcode for seoul south korea?,139-799
what type of government does the bahamas have?,"Parliamentary system, Unitary state, Constitutional monarchy"
where is bosnia?,"Europe, Eurasia, Balkans"
what countries speak german as a first language?,"Canada, German Democratic Republic, Luxembourg, Switzerland, Liechtenstein, Germany, West Germany, Belgium, Vatican City, Second Polish Republic"
where is amazon based out of?,Seattle
what team did mike piazza retire with?,New York Mets
where did robert boyle study?,"Eton College, University College, Oxford"
what is there to see near the grand canyon?,"Phoenix, Grand Canyon National Park, Lake Powell"
where does the fda get its authority?,Commisioner of Food and Drugs
where does hector camacho live?,United States of America
what language do cyprus speak?,"Greek Language, Turkish Language"
where does fabio aurelio play?,"Grêmio Foot-Ball Porto Alegrense, Liverpool F.C."
what war did george washington help win?,American Revolutionary War
where does danny ainge live?,"Wellesley, Eugene"
who plays young joe dirt?,David Spade
what company did verizon used to be?,AT&T Corporation
who was king tut's wife?,Ankhesenamun
what are the kennedys?,"Rose Fitzgerald Kennedy, Patrick Bouvier Kennedy, John F. Kennedy, Rosemary Kennedy, Caroline Kennedy, Kathleen Cavendish, John F. Kennedy, Jr., Joseph P. Kennedy, Sr., Bobby Shriver, Joseph P. Kennedy, Jr."
where kurdish people come from?,Asia
where is sarajevo located?,"Federation of Bosnia and Herzegovina, Bosnia and Herzegovina, Sarajevo Canton"
what is the official language in china?,"Nepali Language, Standard Tibetan, Chinese language, Zhuang languages, Korean Language, English Language, Esperanto Language, Mongolian language, Portuguese Language, Cantonese"
what teams are left in the nfl?,"New York Jets, Carolina Panthers, Denver Broncos, Baltimore Ravens, Detroit Lions, Kansas City Chiefs, Arizona Cardinals, New York Giants, Jacksonville Jaguars, Oakland Raiders"
what art movement was pablo picasso part of?,"Cubism, Analytic cubism, African Period, Picasso's Blue Period, Italian modern and contemporary art, Synthetic cubism, Picasso's Rose Period"
what type of business is mitt romney in?,Politician
what language do they speak in egyptian?,"Sa'idi Arabic, Domari Language, Nobiin Language, Bedawi Arabic, Arabic Language, Siwi Language, Egyptian Arabic, Arabic, Sudanese Spoken Language"
in what year did columbus sail to the new world?,1492 Conquest of Paradise
what countries are included in the continent of asia?,"Bahrain, Afghanistan, Bangladesh, Bhutan, Brunei, Indonesia, India, Cambodia, China, Iraq"
who owns wikimedia foundation?,Jimmy Wales
what war was george washington president during?,American Revolutionary War
which airport do ba fly to in oslo?,"Oslo Airport, Gardermoen, Oslo Airport, Fornebu"
what is there for kids to do in miami?,"Wolfsonian-FIU, Lowe Art Museum, Holocaust Memorial of the Greater Miami Jewish Federation, Miami Art Museum, Frost Art Museum, Coral Castle, Jewish Museum of Florida, Jungle Island, Miami Seaquarium, Venetian Pool"
what country columbus was born?,Genoa
what bella name her baby?,Renesmee Carlie Cullen
what is the houston rockets mascot?,Clutch
what is there fun to do in san diego?,"Hotel del Coronado, Cabrillo National Monument, San Diego Zoo Safari Park, San Diego Zoo, Mission San Diego de Alcalá, Old Town San Diego State Historic Park, Balboa Park, Birch Aquarium, Old Point Loma Lighthouse, USS Midway"
what movies johnny depp is in?,"Benny & Joon, Blow, A Nightmare on Elm Street, Arizona Dream, Chocolat, Dead Man, Charlie and the Chocolate Factory, Cry-Baby, Public Enemies, Corpse Bride"
what countries did andy warhol work?,United States of America
what songs does katherine jenkins sing?,"O Holy Night, Seguedilla, Wales Victorious (Bread of Heaven 2003), Time to Say Goodbye, O Sole Mio, Habanera, One Fine Day, House of No Regrets, Song to the Moon, Caruso"
what is ryan seacrest famous for?,Presenter
what is the current leader of japan?,Shinzō Abe
what does george soros own?,"Open Society Foundations, Soros Fund Management, Open Society Initiative for Southern Africa, Soros Foundations Network, Central European University, Stefan Batory Foundation, Democracy Alliance, MoveOn.org, Drug Policy Alliance, J Street"
what kind of money should i bring to dominican?,Dominican peso
who is the president of ecuador in 2012?,Rafael Correa
what city became the capital of the assyrian empire?,Assur
who started the federal reserve board?,"Woodrow Wilson, Franklin D. Roosevelt, Paul Warburg, Carter Glass"
where did marco rubio go to college?,"Santa Fe College, University of Miami, University of Florida, Tarkio College, Missouri, South Miami High School, University of Miami School of Law"
where in tennessee are the smoky mountains?,Appalachian Mountains
where was emperor tiberius born?,Rome
who did ronald reagan get shot by?,"John Hinckley, Jr."
what county is novato in?,Marin County
who did president kennedy marry?,Jacqueline Kennedy Onassis
what movies did zoe saldana play in?,"The Losers, Colombiana, Star Trek, Avatar, Drumline, Death at a Funeral"
where to go in mexico for vacation?,Yucatán
who does nikki reed play in the movie twilight?,Rosalie Hale
what does matt dallas do now?,Actor
where did frank bruno live?,United Kingdom
what type of cancer did donna summer died from?,"Lung cancer, Cancer"
where's the hudson river?,New York City
how long is queen victoria's reign?,"Her sixty-two year reign began in 1837 when her uncle, William IV, died without an heir."
what is the state flower of pennsylvania?,Kalmia latifolia
what school did michael jackson attend?,Montclair College Preparatory School
what does kenya moore do for a living?,"Film Producer, Model, Actor"
who was wale signed to?,"Def Jam Recordings, Warner Bros. Records, Roc Nation, Allido Records, Interscope Records"
who did tyson chandler play for?,New York Knicks
what character did liv tyler play in lord of the rings?,Arwen
who played princess leia in star wars movies?,Carrie Fisher
what did barack obama do before he took office?,Illinois State Senator
where was saint joseph from?,Canaan
where does kenya moore get her money?,Actor
what round did manny pacquiao win in?,celebritynetworth.com
what are countries in south asia?,"Afghanistan, Maldives, Bangladesh, Bhutan, Tibet, British Indian Ocean Territory, Nepal, Daoud's Republic of Afghanistan, Sri Lanka, Democratic Republic of Afghanistan"
where is the caribbean geographically located?,Puerto Rico
what songs does tom delonge sing?,"I Miss You, All the Small Things"
where did monta ellis go to college?,Sidney Lanier High School
what was the cause of death of michael jackson?,"Homicide, Cardiac arrest"
who played laura ingalls mother?,Caroline Ingalls
what is the capital city of texas usa?,Austin
what is the main language spoken in switzerland?,"Romansh language, French Language, German Language, Italian Language"
what timezone is indianapolis in now?,North American Eastern Time Zone
where do cruises leave from in rome?,Civitavecchia Ferry Terminal
what time zone is new england usa in?,North American Eastern Time Zone
what is tulane university's mascot?,Riptide the Pelican
where is aviano air force base located?,Italy
who is the owner of the philadelphia eagles?,Jeffrey Lurie
where did giovanni da verrazano live?,Dieppe
what movies does johnny depp play in?,"Benny & Joon, Blow, A Nightmare on Elm Street, Arizona Dream, Chocolat, Dead Man, Charlie and the Chocolate Factory, Cry-Baby, Public Enemies, Corpse Bride"
who has won the last 10 nba championships?,"Phoenix Suns, Golden State Warriors, Los Angeles Lakers, Cleveland Cavaliers, Houston Rockets, Charlotte Bobcats, Detroit Pistons, Indiana Pacers, Utah Jazz, Orlando Magic"
who is the coach of the pittsburgh steelers 2005?,Bill Cowher
when are the summer olympics held?,Once every two years
when did mcgee start on ncis?,NCIS - Season 1
what atom did j.j thomson discover?,"The electron in chemistry, Tendencies of recent investigations in the field of physics, Electricity and matter, Rays of positive electricity and their application to chemical analyses, Conduction of electricity through gases, The discharge of electricity through gases, Elements of the mathematical theory of electricity and magnetism, A treatise on the motion of vortex rings"
what country did the zulu live in?,"Zambia, Zimbabwe, Mozambique, KwaZulu-Natal"
where to fly in for galapagos islands?,"Seymour Airport, San Cristóbal Airport"
who has tom brady played for?,"Michigan Wolverines football, New England Patriots"
who are betty white's husbands?,"Lane Allen, Allen Ludden, Dick Barker"
what are the major languages spoken in italy?,Italian Language
what years have the giants won the world series?,"2010 World Series, 2012 World Series"
where did nick clegg go to prep school?,Caldicott School
where did laura bush grow up?,Midland
what currency should i take to mauritius?,Mauritian rupee
what is a judge in the supreme court called?,Chief Justice of the United States
what did johannes kepler accomplish?,"Mathematician, Astronomer, Scientist, Astrologer"
what college did edgar allan poe go to?,University of Virginia
who is ellen albertini dow?,Actor
where is the singapore zoo?,Singapore district
what town was abe lincoln born in?,Hodgenville
what do ethiopia import and export?,"Leather and Hide Tanning and Finishing, Coffee and Tea Manufacturing, Livestock Merchant Wholesalers"
what challenges did helen keller have to face?,"Deafness, Vision loss"
who is andy williams brother?,"Bob Williams, Dick Williams, Don Williams"
who was the 2nd prime minister of pakistan?,Muhammad Zia-ul-Haq
where does morrissey live 2010?,Manchester
who played atticus finch in the movie?,Gregory Peck
where did toussaint louverture live?,Haiti
what other countries share a border with china?,"Pakistan, Kyrgyzstan, Myanmar, Bhutan, Afghanistan, Tajikistan, India, Mongolia, Laos, Kazakhstan"
