questions,answers
who was johnny cash's first wife?,Vivian Liberto
where do tasmanian devils live?,In Tasmania
what a city in montana?,Helena
what was the milwaukee brewers old name?,Seattle Pilots
what type of political system does russia have?,Constitutional republic
what is the political system in egypt?,"Semi-presidential system, Constitutional republic, Republic, Unitary state"
what airport is in kauai hawaii?,Lihue Airport
where are vw cc made?,Germany
what team chris paul play for?,Los Angeles Clippers
what currency should i take to jamaica?,Jamaican dollar
what is illinois state bird?,Northern Cardinal
what three continents touch the atlantic ocean?,"Canada, Europe, Western Sahara, United States of America, France, Sierra Leone, Ireland, Guyana, Nicaragua, Maine"
what language do u speak in egypt?,Modern Standard Arabic
what teams has lionel messi played for?,"Argentina national football team, FC Barcelona, FC Barcelona C, FC Barcelona B"
what time zone is colorado springs co?,Mountain Time Zone
what school did sergio romo go to?,University of North Alabama
who did adam sandler married?,Jackie Sandler
when did the name jehovah first appear?,Jehovah's Witnesses
what is the best island to visit in greece?,Ionian Islands
where did john howard live?,Sydney
what music did beethoven composed?,"Opera, Classical music"
what does the name rome mean?,Romulus and Remus
what did george steinbrenner do?,"Entrepreneur, Theatrical producer, Businessperson, Investor"
who was hadrian and what did he do?,Hadrian's Wall
what influenced langston hughes to write?,Walt Whitman
where did pablo picasso die?,Mougins
who was judy collins married to?,"Peter Taylor, Louis Nelson"
when was the last time the toronto maple leafs make the playoffs?,1967 Stanley Cup Finals
what do they speak in cambodia?,"French Language, Cambodian French, Khmer language"
who is the prime minister of new zealand now?,John Key
what time is nebraska now?,"Mountain Time Zone, Central Time Zone, UTC−07:00, UTC−06:00"
what did nick carter sister died of?,guitar
who is james dean?,Actor
who do roman catholics give authority to?,Pope
where did pres. obama go to school?,"Occidental College, Harvard Law School, Noelani Elementary School, Punahou School, State Elementary School Menteng 01, St. Francis of Assisi Catholic School, Columbia University"
who is nina dobrev playing in perks of being a wallflower?,Candace
when did moscow burn?,1812 Fire of Moscow
who is larry ellison oracle?,"Entrepreneur, Businessperson, Investor"
what is the zip code for fort stockton texas?,79735
what teams drafted the morris twins?,Phoenix Suns
what state does obama come from?,Honolulu
what is vanderbilt's mascot?,Mr. Commodore
what did whitney houston die off?,"Drowning, Coronary artery disease, Cocaine overdose"
when was george w bush sworn in?,George W. Bush 2001 presidential inauguration
what are the airports in chicago?,"Lansing Municipal Airport, O'Hare International Airport, Chicago Midway International Airport, Chicago Executive Airport, Schaumburg Regional Airport, Aurora Municipal Airport, Lewis University Airport, Gary/Chicago International Airport, Waukegan Regional Airport"
what was van gogh famous for?,Painter
where did jane goodall go to school?,University of Cambridge
who won 2012 presidential election in france?,Nicolas Sarkozy
what did thomson discover with his cathode ray tube experiment?,Electron
where did emily murphy go to school?,Bishop Strachan School
what are the major religions in russia?,"Russian Orthodox Church, Islam"
what do most nigerians speak?,English Language
what to do at fairfield ca?,"Fairfield Center for Creative Arts, Pepper Belly's Comedy Club, Milan Institute of Cosmetology, Solano Community College"
where president nixon was born?,Yorba Linda
what currency does thailand accept?,Thai baht
what else did eli whitney invent?,"Interchangeable parts, Cotton gin, Milling"
what jobs did albert einstein have?,"Writer, Author, Mathematician, Professor, Theoretical Physicist, Physicist, Philosopher, Scientist, Peace activist, Pacifist"
where to travel around sydney?,"The Rocks, Rose Seidler House, Bondi Beach, Sydney Opera House, Luna Park Sydney, Wild Life Sydney, Darling Harbour, Sydney Harbour Bridge, St Mary's Cathedral, Sydney, Powerhouse Museum"
what are the names of michael jackson movies?,"Michael Jackson: The Trial and Triumph of the King of Pop, Moonwalker, Listen Up! The Lives of Quincy Jones, Maniac Magee, Miss Cast Away, Michael Jackson: Live in Japan, Michael Jackson: Live in Bucharest: The Dangerous Tour, Miles Davis: Live in Montreal, Michael Jackson's Ghosts, The Wiz"
what timezone is illinois on?,"Central Time Zone, UTC−06:00"
what is the currency in france?,"CFP franc, Euro"
where is the head office of hsbc bank?,New York City
what is the currency in england 2012?,UK £
where is spain exactly located?,"Iberian Peninsula, Europe"
what is the currency name of china?,Renminbi
what movies did charlie hunnam play in?,Green Street
what kind of government does italy have?,"Constitutional republic, Parliamentary republic, Unitary state"
what year michael jordan came in the nba?,1984 NBA Draft
what year did florida marlins win the world series?,2003 World Series
what movie did marlee matlin won an academy award for?,Children of a Lesser God
who is leann rimes with now?,Eddie Cibrian
what countries did queen elizabeth ii rule?,United Kingdom
who played forrest gump as a kid?,Michael Connor Humphreys
where was the battle of vicksburg held?,Warren County
what are the duggars kids names and ages?,Jana Duggar
where does ben stiller live in ny?,New York
what is the official language in mexico?,Spanish Language
what wars did ulysses s grant served in?,"Grant rises in the West., Ulysses S. Grant: The Unlikely Hero, Ulysses S Grant, 1861-1864, The Civil War memoirs of Ulysses S. Grant, The generalship of Ulysses S. Grant, Grant, Grant and Twain: The Story of a Friendship That Changed America, Letters of Ulysses S. Grant to His Father and His Youngest Sister, Personal memoirs, Ulysses S. Grant: The Soldier And the Man"
what type of government does fiji have?,"Military dictatorship, Military junta, Parliamentary republic"
in what state did the bloody battle of antietam take place?,Sharpsburg
where did vietnamese people originate from?,Asian
who was dan cody?,American football player
what are all the inventions benjamin franklin made?,"Lightning rod, Franklin stove, Bifocals, Glass harmonica"
what was wrong with joan crawford?,"Myocardial infarction, Pancreatic cancer"
who does debbie dingle go out with?,"Eli Dingle, Scott Windsor, Andy Sugden, Jasmine Thomas"
what country was anton van leeuwenhoek from?,"Dutch Republic, Netherlands"
what does latin america consist of?,"Bolivia, Honduras, Cuba, El Salvador, Guatemala, Costa Rica, Cuauhtémoc, D.F., Great Pyramid of Tenochtitlán, Paraguay, Belize"
who is the manager of the st louis cardinals?,Mike Matheny
where in oregon was stand by me filmed?,"Mahonia aquifolium, Oregon Swallowtail, Western Meadowlark, Alis volat propriis, Pseudotsuga, Chinook salmon, Milk"
what did writers of the harlem renaissance write about?,"William Henry Draper, Jr."
what is the language they speak in jamaica?,"Jamaican Creole English Language, Jamaican English"
where to live in duluth ga?,You'll Like My Mother
what is the currency in australia 2011?,Australian dollar
what state was theodore roosevelt from?,New York
what does the term prima donna mean?,"Personal assistant, office temp-worker"
what form of government does brazil have?,"Constitutional republic, Presidential system, Federal republic"
where did lebron james go to highschool?,St. Vincent – St. Mary High School
where do the fla marlins play?,Marlins Park
what type of art does wassily kandinsky do?,Painting
who won london mayoral elections 2012?,Stephen Foster
who was arthur miller father?,Isidore Miller
what super bowls have the giants won?,"2010 World Series, 2012 World Series"
where was rod stewart born?,Highgate
what did jack kevorkian go to prison for?,Assisted suicide
who is ruling tunisia now?,Ali Laarayedh
who played eowyn in the lord of the rings movies?,Miranda Otto
where is the parliament in south africa?,Cape Town
what important office did abraham lincoln hold?,"United States Representative, President of the United States, Member of Illinois House of Representatives"
where did michael jordan play high school basketball?,Emsley A. Laney High School
what type of cancer did huell howser die of?,Prostate cancer
what timezone is minneapolis in?,Central Time Zone
who is aidan davis?,"Street dance, Presenter"
what was nicolaus copernicus occupation?,Astronomer
what did richard arkwright contribute to the industrial revolution?,Spinning frame
what kind of currency does greece have?,Euro
when did manchester united first win a trophy?,FA Cup 1976–77
what to see in washington dc in 2 days?,"White House, The Phillips Collection, United States Capitol, Thomas Jefferson Memorial, National Museum of the American Indian, International Spy Museum, National Portrait Gallery, Washington Monument, Lincoln Memorial, Freer Gallery of Art"
where is azerbaijan?,"Europe, Eurasia, Asia"
what is the money of argentina called?,Argentine peso
what did bella abzug do?,Lawyer
what sights to see in madrid?,"Paseo del Prado, Thyssen-Bornemisza Museum, Almudena Cathedral, Plaza de Cibeles, Puerta del Sol, Royal Palace of Madrid, Museo de Lazaro Galdiano, Gran Vía, Museo Nacional Centro de Arte Reina Sofía, Plaza Mayor, Madrid"
what good things has angelina jolie done?,Academy Award for Actress in a Supporting Role
what films has gerard butler starred in?,"Attila, Beowulf & Grendel, 300, Dear Frankie, Butterfly on a Wheel, Gamer, Fast Food, Dracula 2000, Coriolanus"
where was alice paul born?,Mount Laurel Township
what did john quincy adams died of?,Cerebral hemorrhage
what is means testing medicare?,Centers for Medicare and Medicaid Services
who did juan ponce de leon mary?,Leonor de León
what is the political system in italy?,"Constitutional republic, Parliamentary republic, Unitary state"
who is the leader of france 2012?,Nicolas Sarkozy
who is raquel welch's daughter?,Tahnee Welch
what kind of art did leonardo da vinci produce?,"Sculpture, Painting, Drawing"
what money is used in the maldives?,Maldivian rufiyaa
what is anderson cooper?,CNN
where does mike leach coach?,Washington State Cougars football
what condition does michael j fox have?,Parkinson's disease
where did jrr tolkien live?,United Kingdom
what are the major languages of italy?,"Albanian language, Austrian German, Esperanto Language, Italian Language, Occitan language"
what to do in panama city beach fl?,"Thunder Beach Motorcycle Rally, Club La Vela, Man in the Sea Museum, Camp Helen State Park, Pier Park, Shipwreck Island, Latimer Cabin, St. Andrews State Park, Miracle Strip at Pier Park"
where is san miguel mexico on map?,"Guanajuato, Mexico"
where does the tsunami happened in japan?,Japan
where are the great pyramid of giza located?,Cairo Metro
what was liam neeson's character in star wars?,Qui-Gon Jinn
what team does sergio aguero play for?,Argentina national football team
what is the capital of georgia?,Atlanta
when did they stop making ford rangers?,2011 Ford Ranger
what color is miley cyrus red hair?,therichest.org
what is chris paul's son name?,Christopher Emmanuel Paul II
what did einstein invent?,Einstein refrigerator
who does josh hutcherson play in the hunger games?,Peeta Mellark
what is the state flag of colorado called?,Flag of Colorado
who plays claire in lost?,Hayden Panettiere
who are senators from new jersey?,"Joseph S. Frelinghuysen, Frederick Frelinghuysen, Frank Lautenberg, Jon Corzine, Frederick T. Frelinghuysen, Jonathan Elmer, Philemon Dickinson, William Paterson, John Rutherfurd, Bob Menendez"
who does jamie campbell bower play in breaking dawn?,Anne Elizabeth Roseberry
where marie curie come from?,Warsaw
who is facebook's founder?,Mark Zuckerberg
what kind of money do you use in aruba?,Aruban florin
what language do people speak in costa rica?,Spanish Language
what is lil wayne real name?,Dwayne Carter III
what is the political system of the us?,Federal republic
what religions are practiced in afghanistan?,"Shia Islam, Sunni Islam"
where is the world series 2012 being played?,"The Gashouse Gang: How Dizzy Dean, Leo Durocher, Branch Rickey, Pepper Martin, and Their Colorful, Come-from-Behind Ball Club Won the World Series - and America's Heart - During the Great Depression"
where does allen iverson live now?,Hampton
where was dwight howard born?,Atlanta
where do guyanese people live?,Guyana
where is alexandria located?,Egypt
who was the fascist dictator of germany?,Hitler
what is australian currency?,Australian dollar
what did michelle obama do?,First Lady of the United States
where do most chinese live?,China
when did the raiders win the superbowl?,Super Bowl XV
where is the euro used?,"Italy, Portugal, Finland, Luxembourg, France, Slovenia, Austria, Germany, Greece, Spain"
how rich is the roman catholic church?,Catholicism
where did pixie lott go to school?,Italia Conti Academy of Theatre Arts
what date did we invade iraq?,2003 invasion of Iraq
what is the new orleans hornets new name?,Charlotte Hornets
what did darry look like?,Male
when did braves win the world series?,1995 World Series
what is the name of walt disney's son?,Roy O. Disney
what are some sights to see in rome?,"Sistine Chapel, Piazza Navona, Roman Forum, Baths of Caracalla, Castel Sant'Angelo, Bocca della Verità, Pantheon, St. Peter's Basilica, Raphael Rooms, Colosseum"
what is the battle of antietam?,"Maryland Campaign, American Civil War"
what time zone is it in london england?,Greenwich Mean Time
who was governor of texas in 2003?,Rick Perry
what is yale university mascot?,Handsome Dan
what language group does polish belong to?,Lechitic languages
what is the name of the new orleans saints football stadium?,Mercedes-Benz Superdome
what are five countries that border france?,"Italy, Monaco, Luxembourg, Andorra, Switzerland, Germany, Bay of Biscay, Belgium, Piedmont, Spain"
where was hockey world cup 2010 held?,The Cup
when did yuvraj made his odi debut?,10/3/2000
what type of music was scott joplin noted for?,Ragtime
where did sergio romo go to college?,University of North Alabama
what happened to peter parker's uncle?,Marvel Comics
in what city did machiavelli live?,Florence
what illnesses did george washington have?,"Malaria, Smallpox, Tuberculosis"
where is north port florida located?,"Sarasota County, United States of America, Florida"
who was the voice of kitt?,William Daniels
who is the speaker of the house of representatives currently?,Nancy Pelosi
when did sean murray first appear on ncis?,2003
who is abraham maslow?,Psychologist
what is benedict arnold famous for?,Traitor
where is the original mona lisa?,Louvre
what is jill wagner on wipeout?,Him/Herself
what type of language does peru speak?,"Omagua Language, Spanish Language, Waorani Language, Quechua, Puquina Language, Aymara language"
which team does ronaldinho play for 2013?,Brazil national football team
what kind of books does nicholas sparks wrote?,"Das Lächeln der Sterne., Weg Der Traume, Three weeks with my brother, Dear John, A bend in the road, Weg der Träume., Une bouteille à la mer, A Tout Jamais, At first sight, The Choice"
what happened to the people in chernobyl?,"Nuclear accident, Industrial disaster"
what countries has spanish as their official language?,"Honduras, Uruguay, El Salvador, Panama, Equatorial Guinea, Andorra, Guatemala, Puerto Rico, Paraguay, Belize"
what business does raj kundra do?,"Entrepreneur, Businessperson, Film Producer"
what movies is molly ringwald in?,"Office Killer, The Breakfast Club, Sixteen Candles, Fresh Horses, Strike It Rich, Betsy's Wedding, Pretty in Pink, Spacehunter: Adventures in the Forbidden Zone, The Stand, Tempest"
what is the time zone in california called?,Pacific Time Zone
what did michael faraday accomplish?,Experimental researches in electricity
what was the name of the newspaper where hemingway wrote?,Toronto Star
who will alex smith play for in 2011?,San Francisco 49ers
what is the northeast of the united states?,Canada
what currency does brazil use?,Brazilian real
what timezone does sweden have?,Central European Time
who played lois en superman?,"Dana Delany, Anne Heche, Kate Bosworth, Amy Adams, Margot Kidder"
where does the zambezi river end?,Indian Ocean
what is the money currency in switzerland?,Swiss franc
what state did george washington live in?,Virginia
where is mount vernon virginia?,"Fairfax County, Virginia, Washington metropolitan area"
where is kia car from?,South Korea
where do the kansas city chiefs play?,Kansas City
what countries does the mississippi river run through?,United States of America
in what modern country is the yucatan peninsula located?,Mexico
who is lincoln steffens?,Journalist
what type of political system does iran have?,"Islamic republic, Theocracy, Unitary state"
who does the voice of lois in family guy?,Alex Borstein
what are all the movies channing tatum has been in?,"A Guide to Recognizing Your Saints, Battle in Seattle, Stop-Loss, Step Up, Coach Carter, She's the Man, Havoc, Poor Things, Supercross, G.I. Joe: The Rise of Cobra"
what state did woodrow wilson represent?,New Jersey
what hardships did teddy roosevelt overcome?,Cardiovascular disease
where is university of alabama located?,"Tuscaloosa, Alabama, United States of America"
who was arthur miller influenced by?,Henrik Ibsen
where is el salvador located?,Americas
what year was kevin durant drafted?,2007 NBA Draft
what illnesses did george washington suffer from?,"Malaria, Smallpox, Tuberculosis"
what are some places to visit in barcelona?,"Museu Picasso, Gothic Quarter, Barcelona, Park Güell, La Rambla, Palau de la Música Catalana, Sagrada Família, Plaça d'Espanya, Barcelona, Barcelona Museum of Contemporary Art, Casa Milà, Museu Nacional d'Art de Catalunya"
who played princess leia from star wars?,Carrie Fisher
who is the current queen of australia?,Elizabeth II
where did galileo go to school?,University of Pisa
who did david villa play for?,Spain national football team
what did copernicus invented?,Copernican heliocentrism
what's jamaica country code?,jm
where robert frost went to school?,"Dartmouth College, University of Oxford, Harvard University, University of Cambridge, Bates College"
what currency should i take to dubai?,United States dollar
what county is plainfield il in?,Will County
what country is the mekong river located in?,"Thailand, Vietnam, Cambodia, Laos"
who founded the sisters of saint joseph?,Rachel
what is there to do in gatlinburg in december?,37738
where does the english football team train?,the Federation of Free States
who did anne frank wrote her diary to?,Kitty became so idealized and started to lead her own life in the diary that it ceases to matter who is meant by 'Kitty'. The name ... is not meant to be me.
who is tony romo engaged to?,Candice Crawford
what state was hillary clinton a senator for?,New York
what market does starbucks operate in?,"Cafe / Coffee Shop, American food, Bakery, Delicatessen, Bagels"
what country does nike operate in?,"Earth, United States of America, Oregon"
what characters does trey parker voice?,"Eric Cartman, Fosse McDonald, Kenny McCormick, Chef, Butters Stotch, Mr. Garrison, Kyle Broflovski, Stan Marsh"
where will euro 2012 be?,"Italy, Portugal, Finland, Luxembourg, France, Slovenia, Austria, Germany, Greece, Spain"
who the voice of lois griffin?,Alex Borstein
when did the 7th harry potter book come out?,The gospel according to Harry Potter
where is south carolina located?,United States of America
who are paul revere's parents?,"Deborah Hitchborn, Apollos Rivoire"
what political system does russia use?,Constitutional republic
what are american staffordshire terriers?,Dog
what language is mainly spoken in england?,English Language
what awards has morgan freeman won?,"Golden Icon, National Board of Review Award for Best Actor, London Film Critics Circle Award for Best Actor, Golden Globe Award for Best Actor - Musical or Comedy Film, National Society of Film Critics Award for Best Supporting Actor, Kennedy Center Honor, Camie Award, NAACP Image Award for Outstanding Supporting Actor in a Motion Picture, Academy Award for Actor in a Supporting Role"
who will michael schumacher drive for in 2013?,Omega SA
what kind of government does the united states have today?,"Presidential system, Federal republic, Representative democracy, Two-party system, Constitutional republic, Republic"
what is the braves mascot?,Major League Baseball
where to stay in paris france?,"Hôtel Ritz Paris, Hôtel de Crillon"
what teams did george steinbrenner own?,New York Yankees
what to see and do in revelstoke?,Kinbasket Lake
what land did god give to israel?,Israel
what guitar did andres segovia use?,Spanish acoustic guitar
what style of art did vincent van gogh do?,Post-Impressionism
where did the tutsi come from?,Rwanda
what country did osama bin laden live in?,"Sudan, Afghanistan, Saudi Arabia, Pakistan"
where was the roman empire centered?,Rome
who played samuel sullivan in heroes?,Robert Knepper
what time zone is cincinnati oh in?,North American Eastern Time Zone
who was jacob riis and why was he important?,"Photographer, Journalist, Artist"
where does peter king live?,New York City
what are west african countries?,"Ghana, Mauritania, Gambia, Côte d’Ivoire, Mali, Togo, Guinea-Bissau, Guinea, Burkina Faso, Benin"
where are the mines in victoria?,Victoria
what years have the cubs been in the world series?,"1908 World Series, 1907 World Series"
what car companies does ford motor company own?,"Ford Super Enhanced Investment Partnership, Ford India Private Limited, Ford Holdings LLC, Ford Mexico Holdings Inc, Ford Capital B.V., Flat Rock Assembly Plant, Ford Credit CP Auto Receivables LLC, Ford Motor Co (Switzerland) SA, Ford South America Holdings, LLC"
what type of government does the bahamas?,"Parliamentary system, Unitary state, Constitutional monarchy"
what style of music did jimi hendrix play?,Rock music
what character does mila kunis play on family guy?,Meg Griffin
who played anakin skywalker in phantom menace?,Jake Lloyd
where is luke afb arizona?,Glendale
what language people speak in belgium?,"French Language, German Language, Dutch Language"
where was the battle of vicksburg located?,Warren County
where is the cruise ship terminal in vancouver bc?,"Tsawwassen Ferry Terminal, Horseshoe Bay Ferry Terminal"
what was lincoln's wife's name?,Nancy Lincoln
what does the japanese call their country?,Japan
what did king george vi die of?,Lung cancer
what type of currency is used in the united kingdom?,UK £
when are school holidays in queensland 2013?,Woorabinda
who plays the new michael myers?,Brad Loree
who was killed first tupac or biggie?,Tupac
who won the nobel peace prize in 2007?,"Intergovernmental Panel on Climate Change, Al Gore"
what theme songs did alan thicke wrote?,It Takes Diff'rent Strokes
what films did patrick swayze star in?,"City of Joy, Christmas in Wonderland, Father Hood, Along for the Ride, Black Dog, George and the Dragon, Donnie Darko, Dirty Dancing: Havana Nights, Dirty Dancing, 11:14"
where is sony headquarters?,Tokyo
who plays sarah wittle in jumanji?,Bonnie Hunt
what type of music is tchaikovsky?,"Opera, Classical music, Ballet, Art song"
when is wimbledon tennis tournament?,Yearly
what year did ted kennedy run for president?,1980 Democratic National Convention
what shows are on in london at the moment?,"World Organization of the Scout Movement, 2008 Raindance Film Festival, Grunwick dispute, 2003 London blackout, 1st Computer Olympiad, Ocean transport and erection of Cleopatra’s Needle, (from Egypt to) London, 1878, Early fires of London, Fathers 4 Justice protests, 2nd Computer Olympiad, Live Earth"
where is german an official language?,"Canada, German Democratic Republic, Luxembourg, Switzerland, Liechtenstein, Germany, West Germany, Belgium, Vatican City, Second Polish Republic"
what language do you speak in iran?,"Turkmen Language, Pashto language, Kurdish language, Gilaki Language, Assyrian Neo-Aramaic Language, Azerbaijani language, Armenian Language, Persian Language, Mazanderani Language, Luri language"
who did tupac shakur date?,Keisha Morris
what did larry hagman die of?,Leukemia
who is the governor of colorado 2009?,Bill Ritter
what timezone is michigan usa?,UTC-5
who seized power in italy in 1922?,Benito Mussolini
what show is jill wagner on?,"Wipeout, Punk'd, Blade: The Series, Teen Wolf"
who did megan fox have a baby with?,Brian Austin Green
what currency does senegal use?,West African CFA franc
what do ethnic russians look like?,Europeans
what places made up the western roman empire?,"Europe, North Africa, Middle East"
what experiments did marie curie conduct?,Radio-active substances
what company did mitt romney run?,Bain Capital
what is the king of spain's name?,Juan Carlos I of Spain
who is blackwell?,"Critic, Journalist, Actor, Fashion Designer"
where did justin bieber grew up?,Canada
what district does john cornyn represent?,Texas
who drafted kevin garnett?,Minnesota Timberwolves
what is zip code for chicago illinois?,"60605, 60604, 60607, 60606, 60601, 60610, 60603, 60602, 60290, 60608"
what is the name of book written by helen keller?,"Light in my Darkness, Die Geschichte meines Lebens, The Frost King, The open door, The World I Live In, Peace at eventide, My religion, Jia ru gei wo san tian guang ming, The Story of My Life, Helen Keller, her Socialist years"
who did the voice of darth vader in star wars?,James Earl Jones
what are the duggars kids full names?,Jana Duggar
who is prime minister of japan 2011?,Yoshihiko Noda
what year did aaron rodgers get drafted?,2005 NFL Draft
who plays the voice of kovu?,Jason Marsden
who is martin luther king jr wife?,Coretta Scott King
