questions,answers
where to stay in south rim grand canyon?,Grand Canyon South Rim Ranger's Dormitory
what beach did the canadians assault?,"Émilie Heymans, Blythe Hartley"
what currency can you use in aruba?,Aruban florin
where does roman abramovich live?,"Moscow, Ukhta"
who is nolan ryan married to?,Ruth Holdorff
where to travel in africa in january?,"Angola, Côte d’Ivoire, Central African Republic, Burkina Faso, Djibouti, Congo, Burundi, Botswana, Cape Verde, Benin"
who played carlton banks?,Alfonso Ribeiro
who does matt damon have kids with?,Luciana Barroso
who is the current leader of cuba today?,Raúl Castro
what did anasazi indians live in?,Four Corners
what part of italy did most immigrants come from?,/g/124x8gxxd
what hotel should i stay in san francisco?,"Palace Hotel, San Francisco"
what events led to napoleon's downfall?,"Arsenic poisoning, Stomach cancer"
where is whitey bulger?,Boston
who created youtube?,"Chad Hurley, Steve Chen, Jawed Karim"
what to do in hong kong for a week?,"Victoria Peak, Hong Kong Museum of Art, Dr Sun Yat-sen Museum, Kowloon Walled City, Po Lin Monastery, Hong Kong Disneyland, Ten Thousand Buddhas Monastery, Lantau Island"
what currency does greece use 2012?,Euro
what is fresno state's zip code?,"93702, 93703, 93701, 93706, 93707, 93704, 93705, 93650, 93708, 93709"
who is angelina jolie husband name?,Brad Pitt
what kourtney kardashian baby girls name?,"Penelope Scotland Disick, Mason Dash Disick"
what is the present form of government in iran?,"Islamic republic, Theocracy, Unitary state"
who did marco polo travel with?,"Niccolò Polo, Nicole Anna Defuseh"
what does icelandic sound like?,"Indo-European languages, North Germanic languages"
where does bill richardson live?,New Mexico
what to do in dubuque this weekend?,Dubuque Arboretum and Botanical Gardens
what club did aguero play for before man city?,Atlético Madrid
who plays jay adams in lords of dogtown?,Him/Herself
what system of government is used in the united states of america?,"Presidential system, Federal republic, Representative democracy, Two-party system, Constitutional republic, Republic"
what is beyonce's daughters name?,Blue Ivy Carter
when did the colts last win the superbowl?,Super Bowl XLI
what college did michael jordan play basketball for?,University of North Carolina at Chapel Hill
what songs has madonna written?,"Masterpiece, Die Another Day, I'll Remember, Give Me All Your Luvin', Future Lovers, Future Lovers/I Feel Love, Like a Prayer, This Used to Be My Playground, Gang Bang, Who's That Girl"
who was andrew johnson and what did he do?,"United States Representative, Vice President of the United States, United States Senator, President of the United States, Governor of Tennessee"
what are the best hotels to stay in san francisco?,"W San Francisco, Hostelling International, City Center, Palace Hotel, San Francisco, Clift"
who was lincoln's vice president when he died?,Andrew Johnson
where did pope benedict xvi live?,Germany
where is tommy emmanuel from?,Australia
with which country does south africa border?,"Lesotho, Zimbabwe, Mozambique, Swaziland, Namibia, Botswana"
what is there to do around austin texas?,"Texas Department of Public Safety Historical Museum and Research Center, Cathedral of Junk, Harry Ransom Center, Texas Memorial Museum, Ann W. Richards Congress Avenue Bridge, Zilker Park, Texas State Capitol, William Sidney Porter House, Bullock Texas State History Museum, Barton Springs Pool"
who plays effy in skins uk?,Kaya Scodelario
what countries use the euro as official currency?,"Italy, Portugal, Finland, Luxembourg, France, Slovenia, Austria, Germany, Greece, Spain"
what kind of money do the netherlands use?,Euro
which college did obama graduated?,Columbia University
who are richard pryor children?,"Franklin Pryor, Steven Pryor, Richard Pryor Jr., Rain Pryor, Kelsey Pryor, Elizabeth Pryor, Renee Pryor"
who is golfer dustin johnson dating?,Amanda Caulder
what are the official languages in spain?,Spanish Language
what club did santi cazorla play for?,Spain national football team
where does the atlanta braves play?,Turner Field
what year did detroit pistons win nba championships?,"1990 NBA Finals, 2004 NBA Finals, 1989 NBA Finals"
what each fold of the us flag means?,United States of America
what do people from spain speak?,Spanish Language
who did king tut married?,Ankhesenamun
how old was woodrow wilson when he was elected president?,"Woodrow Wilson 1917 presidential inauguration, Woodrow Wilson 1913 presidential inauguration"
what political party did john bell belong to?,"Know Nothing, Whig Party, Democratic Party, National Republican Party, Democratic-Republican Party, Constitutional Union Party"
what religion is mary queen of scots?,Catholicism
who is chris cooley married to?,Christy Oglevee Cooley
where is port st johns florida?,Florida
what teams does kroenke own?,"St. Louis Rams, Arsenal F.C., Colorado Avalanche, Colorado Rapids, Denver Nuggets"
what did theodor schwann contribute to our understanding of cells?,Microscopical researches into the accordance in the structure and growth of animals and plants
where is kate spade from?,Kansas City
what countries are in the caribbean?,"School of Business and Computer Science, Port of Spain, School of Business and Computer Science, Trincity, Lesser Antilles, School of Business and Computer Science, San Fernando, Leeward Islands, School of Business and Computer Science, Champs Fleurs, British Virgin Islands, Puerto Rico, University of the West Indies, Anguilla"
what freeview channel is bbc three?,BBC Three
what party was woodrow wilson from?,Democratic Party
what part does seth macfarlane play in family guy?,"Peter Griffin, Mickey McFinnegan, Stewie Griffin, Jake Tucker, Glenn Quagmire, Carter Pewterschmidt, Stan Smith, Tom Tucker, Kevin Swanson, Brian Griffin"
what type of government does vietnam have today?,Socialist state
what did ben hall do?,Bushranger
where is the university of oregon state?,Oregon
where put thermometer in turkey?,Turkish region is not suited to be the administrative division type for Turkish Region.
who did george wendt play on cheers?,Norm Peterson
what division did the baltimore colts play in?,AFC South
what year did us invaded iraq?,2003 invasion of Iraq
what is the local currency in the dominican republic?,Dominican peso
what is the capital city of canada on a map?,Ottawa
what ethnicity are people from iran?,Persian
where did the germans come from wiki?,Germany
what movie did tom hanks won his first oscar?,Big
when was ancient egypt created?,eg
what famous people are from kansas city?,"Cecil Newman, Robert Altman, Dianne Wiest, Walter J. Ong, Yvette Vickers, Monique Gabrielle, Andrea Ciliberti, Edward Tufte, Yudell Luke, Crystal Smith"
what country did francis drake represent?,England
what timezone is indianapolis indiana in?,North American Eastern Time Zone
what did darwin propose as the mechanism of evolution?,"""""It is not the strongest of the species that survives, nor the most intelligent, but the one most responsive to change."""""
what are popular sports in spain?,"Spain women's national handball team, Spain men's national volleyball team, Spain national beach handball team, Spain national football team, Spain women's national volleyball team, Spain national handball team"
what did corey haim act in?,"Fast Getaway, Fast Getaway II, Dream a Little Dream 2, Demolition High, Dream a Little Dream, Blown Away, Busted, Demolition University, Fever Lake, Firstborn"
who is the publisher of the wall street journal?,Dow Jones & Company
what do tibetan people speak?,"Nepali Language, Standard Tibetan, Chinese language, Baima language, Tibetan languages"
what form of government does afghanistan have?,Islamic republic
who was the wife of king edward vii?,Alexandra of Denmark
what position did john stockton play?,Point guard
when did freddy krueger die?,A Nightmare on Elm Street
what is there to do in niagara falls new york?,"Johann Williams Farm, Niagara Reservation, Adams Power Plant Transformer House, Fallsville Splash Park, Niagara Falls Public Library, Holley-Rankine House, Whitney Mansion, US Post Office-Niagara Falls Main, U.S. Customhouse, Niagara Falls State Park"
who played bernie focker?,Dustin Hoffman
who did troy aikman play for?,Dallas Cowboys
who was mendel and what did he develop?,Scientist
where is universal studios california theme park?,"Glendale, Universal City, Hollywood"
where the grimm brothers were born?,la Belle Durmiente
what sport is popular in china?,"China PR national football team, China men's national volleyball team, China national futsal team, China national baseball team, China women's national basketball team, Bayi Yiyang High-Tech District, China women's national volleyball team, China Fed Cup team, China national cricket team, China Davis Cup team"
what continent is greenland apart of?,North America
which books did john the apostle write?,The Gospel According to John
who made the ancient egyptian pyramids?,Ancient Egypt
where did the san diego chargers originate?,Los Angeles Chargers
who was the voice of nemo's dad?,Albert Brooks
what 4 countries are part of the united kingdom?,"Wales, England, Scotland, Northern Ireland"
who was king george v father?,Edward VII
who played michael myers in halloween 4?,George P. Wilbur
what language do chinese?,Chinese
what did daniel tosh say that was so offensive?,Daniel Tosh: Happy Thoughts
what happened to nagasaki?,Atomic bombings of Hiroshima and Nagasaki
what movies did james franco play in?,"Tristan & Isolde, Pineapple Express, The Great Raid, Annapolis, Whatever It Takes, The Company, An American Crime, Spider-Man, Spider-Man 2, Spider-Man 3"
what does bob dylan sing?,Like a Rolling Stone
what year did john adams get elected president?,4/21/1789
what to do in palo alto ca with kids?,"Hoover Tower, PARC, Stanford Memorial Church, Hewlett-Packard House and Garage, Leland Stanford Junior University Museum of Art, Iris & B. Gerald Cantor Center for Visual Arts, Palo Alto Baylands Nature Preserve, Arastradero Preserve, Stanford Shopping Center, Professorville"
what are the holidays of islam?,"Eid al-Fitr, Ramadan, Eid al-Adha"
who did magellan sail for?,Explorer
where did irish people come from?,Ireland
what to see in downtown asheville nc?,"Asheville Art Museum, Folk Art Center, Grove Park Inn, Pisgah National Forest, Bele Chere, Biltmore Estate, Chimney Rock State Park, Thomas Wolfe House, Carl Sandburg Home National Historic Site, Smith-McDowell House"
where did carrie underwood live?,Checotah
what sports do canadians like?,Canada women's national volleyball team
when did carolina hurricanes win the cup?,2006 Stanley Cup Finals
who currently owns the steelers?,Rooney family
where was toni braxton born and raised?,Severn
who has dirk nowitzki played for?,Dallas Mavericks
what is the currency in the dominican republic called?,Dominican peso
what did maria theresa rule?,"Bohemia, Hungary"
what was jack london's education?,"University of California, Berkeley, Oakland High School"
what club team does ronaldinho play for?,Clube Atlético Mineiro
which countries share borders with spain?,"Perejil Island, Portugal, France, Andorra, Morocco, Gibraltar"
what state did roger sherman represent at the constitutional convention?,Connecticut
what type of money do japanese use?,Japanese yen
what county is bradenton fl located in?,Manatee County
what movies has scarlett johansson played in?,"Girl with a Pearl Earring, Fall, A Good Woman, A Love Song for Bobby Long, Don Jon's Addiction, Eight Legged Freaks, Ghost World, Captain America: The Winter Soldier, An American Rhapsody"
what is the philadelphia church of god?,Protestant Organizations
where did david duke go to college?,"Interregional Academy of Personnel Management, Louisiana State University"
where does bradley cooper live now?,Philadelphia
what country did vasco da gama come from?,Portugal
what country do they speak farsi?,"Canada, Afghanistan, Iran, Oman, Uzbekistan, Bahrain, Iraq, Tajikistan"
who did japan surrender to in ww2?,Iwane Matsui
where does luke skywalker live in star wars?,Tatooine
what is time zone in hawaii?,Hawaii–Aleutian Time Zone
what is john cena doing right now?,"Fast Cars and Superstars: The Gillette Young Guns Celebrity Race, WWE Saturday Night's Main Event, WWE RAW"
what are two countries in south america?,"Carrasco, Chacaltaya, Chile, Pampas, Amazon Basin, French Guiana, Peru, Guyana, Paraguay, Bolivia"
where did kobe bryant attend high school?,Lower Merion High School
what country is vatican city in?,Rome
who played princess leia's mother in star wars?,Padmé Amidala
what type of voting system does the uk have?,Government of the United Kingdom
where donald trump went to college?,"The Kew-Forest School, University of Pennsylvania, Fordham University, Wharton School of the University of Pennsylvania, New York Military Academy"
what did john howard study at university?,Bachelor of Laws
what did duke ellington do?,Musician
from which university did president obama receive his bachelor's degree?,University of Chicago
when was the last time the new england patriots won the superbowl?,Super Bowl XXXVIII
what films has morgan freeman narrated?,A Raisin in the Sun
where are the atlanta falcons located?,Atlanta
what is st francis patron saint of?,All Creatures Of Our God And King
where was tommy emmanuel born?,Muswellbrook
what techniques did frida kahlo use in her paintings?,Surrealism
who does larry david play in seinfeld?,Screenwriter
what type of government does israel?,"Parliamentary system, Democracy"
where is downtown littleton?,Arapahoe County
what did shawnee smith star in?,"The Grudge 3, Saw IV, Summer School, Saw II, Saw III, The Island, Saw, The Blob, Who's Harry Crumb?"
what division is cincinnati bengals in?,AFC North
where was toussaint charbonneau from?,Boucherville
what countries include western europe?,"Kingdom of Great Britain, French First Republic, Austria, Luxembourg, British Isles, Liechtenstein, Western Roman Empire, West Germany, Monaco, Switzerland"
what timezone is new mexico currently in?,"Mountain Time Zone, UTC−07:00"
who is the current president of china 2010?,Hu Jintao
what did harriet beecher stowe do as an abolitionist?,"Novelist, Writer, Author"
in which province is pretoria?,Gauteng
what college did jerry rice attend?,Mississippi Valley State University
who is liz lemon marrying on 30 rock?,Jack Donaghy
what country did john cabot sail for?,Italy
when did mt st helens first erupt?,1980 eruption of Mount St. Helens
where did the name rome come from?,Romulus and Remus
what time zone is fresno ca?,Pacific Time Zone
where did queen isabella live?,Madrigal de las Altas Torres
who played carl fredricksen in up?,Ed Asner
where did robert pattinson go to acting school?,The Harrodian School
who won the super bowl xliv 2010?,New Orleans Saints
what events caused roosevelt to become more of an internationalist?,1932 Democratic National Convention
what do the colors on mali's flag represent?,Flag of Mali
when does school start in los angeles california 2011?,August
what did samuel de champlain?,"Soldier, Sailor, Navigator"
what was william faulkner known for?,"Background to Danger, Flesh, The Big Sleep, The Long, Hot Summer, To Have and Have Not, Land of the Pharaohs, Mildred Pierce, Submarine Patrol, Gunga Din, Drums Along the Mohawk"
what language did the miwok indians speak?,Utian languages
who was audrey hepburn's husbands?,"Robert Wolders, Andrea Dotti, Mel Ferrer"
what do you want from me jerrod niemann lyrics meaning?,"Universal Music Group Nashville, Arista Nashville, Category 5 Records"
what did robert koch do?,Physician
who does cristiano ronaldo play for?,Real Madrid C.F.
what currency is best to take to dominican republic?,Dominican peso
who is lleyton hewitt?,Tennis player
what movies did quentin tarantino star in?,"Grindhouse, The Cutting Edge: The Magic of Movie Editing, Sukiyaki Western Django, Full Tilt Boogie, Z Channel: A Magnificent Obsession, BaadAsssss Cinema, Desperado, Four Rooms, From Dusk till Dawn, Dead On: The Life and Cinema of George A. Romero"
what language does the new zealand speak?,"Esperanto Language, English Language, Māori language, Samoan Language, Tongan Language, Standard Mandarin, Fijian Language"
what kind of drugs does charlie sheen do?,Cocaine
who is clint eastwood dating?,Dina Eastwood
what county is sacramento located in?,Sacramento County
what did audrey hepburn died of?,Appendix cancer
what is st mary mascot?,Griffin
who was irving berlin and what did he do?,"Songwriter, Lyricist, Composer"
who shot j lennon?,Mark David Chapman
what happened during william henry harrison presidency?,Battle of Tippecanoe
where did sir ernest shackleton live?,County Kildare
what type of music is scott joplin?,"Piano, Jazz piano"
where did the welsh language originate from?,Celts
who does leia think her father is?,Bail Organa
who did alf's voice?,Paul Fusco
what was theodore roosevelt's political party?,"Republican Party, Progressive Party"
what year were the cincinnati reds founded?,1881
where is kia cars made?,Seoul
what magazine did edgar allan poe work for?,"The Stylus, Graham's Magazine, Broadway Journal, Burton's Magazine"
where are sunbeam appliances made?,"Canada, United States of America"
where did chickasaw indians live?,Indigenous peoples of the Southeastern Woodlands
what music did antonio vivaldi compose?,"Baroque music, Classical music"
who plays batman in 2012?,Christian Bale
what is the timezone in vancouver?,Pacific Time Zone
what time is world cup soccer?,Every 4 Years
what did ronnie radke do?,"guitar, Lead vocalist, keyboard"
where does selena gomez live right now 2010?,New York City
who is the member of rajya sabha?,"Ch. Munawwar Hasan, Anil Ambani, Jaya Bhaduri Bachchan"
what form of government does czech republic have?,Parliamentary republic
what movies has renee zellweger been in?,Bridget Jones's Diary
what other writers influenced charles dickens?,"Tobias Smollett, Washington Irving, Miguel de Cervantes, William Wordsworth, Honoré de Balzac, Henry Fielding, Victor Hugo, Sheridan Le Fanu, William Shakespeare, Laurence Sterne"
where jay z was raised?,Brooklyn
where did the assyrian empire start?,Middle East
what currency does the dominican republic?,Dominican peso
what is daniel radcliffe name in the woman in black?,Arthur Kipps
what money do they use in thailand?,Thai baht
where does avril lavigne live now?,"Belleville, Greater Napanee"
who plays stewie griffin's voice family guy?,Seth MacFarlane
what should i see in london england?,"Regent's Park, Tower of London, Buckingham Palace, Palace of Westminster, London Eye, Tower Bridge, Hyde Park, Westminster Abbey, St Paul's Cathedral, Trafalgar Square"
what currency is used in england 2012?,UK £
where did paul rudd go to high school?,Shawnee Mission West High School
what gauge strings john mayer?,Blues-rock
what was abe lincoln shot with?,Firearm
what did regina hall play in?,"Scary Movie, First Sunday, Danika, Paid in Full, Disappearing Acts, Malibu's Most Wanted, Scary Movie 4, King's Ransom, Scary Movie 3, Scary Movie 2"
what book did jacob riis wrote?,How the other half lives
what airport is close to scottsdale arizona?,Scottsdale Airport
who plays noah bennet?,Jack Coleman
who won american idol 2006 season 5?,Jordin Sparks
what to see in vietnam in two weeks?,Hanoi
where do the chicago cubs play?,Wrigley Field
where did reagan die?,Bel-Air
what is the language used in indonesia?,"Javanese Language, Malay Language, Sunda Language, English Language, Bali Language, Indonesian Language, Batak Language, Tobelo Language, Dutch Language, Madura Language"
what was irving langmuir famous for?,"Franklin Medal, Perkin Medal, Nobel Prize in Chemistry, John Scott Legacy Medal and Premium"
what are the traditions in jamaica?,"Bobsleigh, Track and field athletics, Swimming"
what is the official language of china called?,Standard Mandarin
where is the gulf of st lawrence river?,"Canada, Québec, United States of America, Ohio"
what was the name of martin luther king jr parents?,"Martin Luther King, Sr., Alberta Williams King"
what money does guatemala use?,Guatemalan quetzal
who was president when nelson rockefeller was vice president?,Gerald Ford
what did freud say about women?,Anatomy is destiny.
who plays young john winchester in supernatural?,Jeffrey Dean Morgan
who killed vincent chin film?,"Ronald Ebens, Michael Nitz"
what region is manchester england?,North West England
where was the gettysburg war located?,Gettysburg
what do people go to amsterdam for?,"Molen van Sloten Windmill, Begijnhof Chapel, Amsterdam Museum, Oude Kerk, Diamond Museum Amsterdam, Sexmuseum, De Gooyer Windmill, Hash, Marihuana and Hemp Museum, Rembrandt House Museum, Jordaan"
who is the elected governor of california?,Jerry Brown
what year did john glenn walk on the moon?,1976 Democratic National Convention
what currency to take to side turkey?,Turkish lira
who founded the new democratic party?,"James Madison, Thomas Jefferson"
what were the causes of the russian revolution in 1917?,World War I
what does julian clary do?,Actor
where does the potomac river flow into?,Chesapeake Bay
where is the olympic national park located?,Washington
when does the world cup occur?,Every 4 Years
where does danish language come from?,"Denmark, Greenland"
what countries are in the baltic region?,"Latvia, Lithuania, Estonia"
what nation did hitler lead?,Germany
when were women allowed to go to the olympics?,The complete book of the Winter Olympics
what continent does the amazon river flow through?,South America
what is a city in belgium?,City of Brussels
who played elle greenaway?,Lola Glaudini
who was andy williams second wife?,Debbie Meyer
where are you from in egyptian arabic?,Egypt
what did captain scott die of?,Starvation
where does the catholic church originated from?,"Paul the Apostle, Saint Peter"
what continent is belize located in?,Central America
who was donald duck's girlfriend?,Daisy Duck
what party was winston churchill in politics?,Conservative Party
what 4 teams did wayne gretzky play for?,Edmonton Oilers
what did taylor swift do at the vmas 2012?,Grammy Award for Best Country Solo Performance
who did russians descend from?,East Slavs
what to see and do in san diego california?,"San Diego Zoo Safari Park, San Diego Zoo, Cabrillo National Monument, Hotel del Coronado, Mission San Diego de Alcalá, Old Town San Diego State Historic Park, Balboa Park, Birch Aquarium, Old Point Loma Lighthouse, USS Midway"
where's wayne state?,"Michigan, United States of America, Detroit"
what dialect do most chinese speak?,Chinese
who is the president of cuba in 2009?,Fidel Castro
who does avril lavigne play in over the hedge?,Heather
where is the country of armenia?,"Turkey, Georgia, Azerbaijan"
who tom cruise been married to?,"Katie Holmes, Nicole Kidman, Mimi Rogers"
which country is gaza city located?,Israel
who is president of pakistan 2012?,Asif Ali Zardari
what instrument did louis armstrong like to play?,"trumpet, Cornet"
what is the currency in germany in 2010?,Euro
what types of government does china have?,Premier of the People's Republic of China
where is the boeing company?,"Seattle, Chicago"
what are the two houses in congress?,"United States House of Representatives, United States Senate"
what team does ladainian tomlinson play 4?,"San Diego Chargers, New York Jets"
what is the major language spoken in canada?,"French Language, English Language"
what jamaican language called?,"Jamaican Creole English Language, Jamaican English"
what planet was luke skywalker raised on?,Tatooine
who did georgia o'keeffe inspired?,Arthur Dove
who does brandon jacobs play for?,San Francisco 49ers
who was queen elizabeth the first's mother?,Anne Boleyn
who is the leader of the dominican republic 2011?,Leonel Fernández
where did the anglican church start?,Archbishop of Canterbury
who does obama look up to?,"Saul Alinsky, Nipsey Russell"
who played heath barkley?,Lee Majors
what year did baltimore ravens win the superbowl?,2012
what is the name of the money used in spain?,Euro
what did edward jenner do for a living?,edward jenner catalogued specimens from captain james cook
what type of political system does north korea have?,"Single-party state, Socialist state, People's Republic, Juche, Unitary state"
when does ramadan end 2012 indonesia?,Yayasan Kerti Praja
who will play clary in city of bones?,Lonnie Clary
what year did edgar allan poe go to college?,2/14/1826
where is amsterdam ohio?,"Jefferson County, Ohio, Springfield Township"
who are the two current senators of illinois?,Dick Durbin
when did the orioles win the pennant?,"1983 World Series, 1966 World Series, 1970 World Series"
what 3 countries does mexico border?,United States of America
who played giles on buffy the vampire slayer?,Anthony Stewart Head
what teams are in the american league west?,"Texas Rangers, Houston Astros, Seattle Mariners, Los Angeles Angels of Anaheim, Oakland Athletics"
what books did robert burns wrote?,"To a Louse, A Red, Red Rose, The letters of Robert Burns, Address to the Deil, Tam o' Shanter, Epitaph for James Smith, To a Mouse, Holy Willie's Prayer, The wit of Robert Burns, The Glenriddell manuscripts of Robert Burns"
who owns chrysler corporation 2012?,Walter Chrysler
what are the name of mitt romney sons?,"Tagg Romney, Josh Romney, Craig Romney, Matt Romney, Ben Romney"
what was the cause of death of larry hagman?,"Head and neck cancer, Cancer, Leukemia"
what is the rainforest in south america called?,Amazon Basin
how many major dialects are there in china?,"Nepali Language, Standard Tibetan, Chinese language, Zhuang languages, Korean Language, English Language, Esperanto Language, Mongolian language, Portuguese Language, Cantonese"
in which country is mount everest found?,"Nepal, China"
what form of government does germany use?,Constitutional republic
